{"$schema":"https://json-schema.org/draft/2020-12/schema","$id":"https://rosstaxsoftware.com/schemas/subdomains/v1","type":"object","required":["version","apex","vercelTarget","records"],"properties":{"version":{"type":"string"},"apex":{"const":"rosstaxsoftware.com"},"vercelTarget":{"type":"string"},"records":{"type":"array","minItems":1,"items":{"type":"object","required":["host","target","owner"],"properties":{"host":{"type":"string"},"target":{"type":"string"},"owner":{"enum":["vercel","clerk"]},"route":{"type":"string"}},"additionalProperties":false}}},"additionalProperties":false}
