{"$schema":"../public/schemas/subdomains.schema.json","version":"1.0.0","apex":"rosstaxsoftware.com","vercelTarget":"cname.vercel-dns.com","records":[{"host":"www","target":"cname.vercel-dns.com","owner":"vercel","route":"/"},{"host":"office","target":"cname.vercel-dns.com","owner":"vercel","route":"/office"},{"host":"etrac","target":"cname.vercel-dns.com","owner":"vercel","route":"/refunds"},{"host":"casework","target":"cname.vercel-dns.com","owner":"vercel","route":"/casework"},{"host":"university","target":"cname.vercel-dns.com","owner":"vercel","route":"/platforms/ross-tax-pro-university"},{"host":"learn","target":"cname.vercel-dns.com","owner":"vercel","route":"/platforms/ross-tax-pro-university"},{"host":"edrive","target":"cname.vercel-dns.com","owner":"vercel","route":"/platforms/ross-e-drive-university"},{"host":"payroll","target":"cname.vercel-dns.com","owner":"vercel","route":"/platforms/ross-prime-payroll"},{"host":"hr","target":"cname.vercel-dns.com","owner":"vercel","route":"/platforms/ross-prime-payroll"},{"host":"pdf","target":"cname.vercel-dns.com","owner":"vercel","route":"/platforms/ross-pdf-editor"},{"host":"training","target":"cname.vercel-dns.com","owner":"vercel","route":"/platforms/tax-solutions-training"},{"host":"support","target":"cname.vercel-dns.com","owner":"vercel","route":"/platforms/support"},{"host":"status","target":"cname.vercel-dns.com","owner":"vercel","route":"/api/health"},{"host":"clerk","target":"frontend-api.clerk.services","owner":"clerk"},{"host":"accounts","target":"accounts.clerk.services","owner":"clerk"},{"host":"clkmail","target":"mail.w6xlczsz1u4s.clerk.services","owner":"clerk"},{"host":"clk._domainkey","target":"dkim1.w6xlczsz1u4s.clerk.services","owner":"clerk"},{"host":"clk2._domainkey","target":"dkim2.w6xlczsz1u4s.clerk.services","owner":"clerk"}]}
